{
  "apiVersion": "agentic-workbench.socios@1",
  "kind": "Workflow",
  "metadata": {
    "name": "a2a-delegate-smoke",
    "version": "0.1",
    "createdAt": "2026-04-02T00:00:00Z"
  },
  "spec": {
    "input": {
      "schemaRef": "inline://none"
    },
    "output": {
      "schemaRef": "inline://delegate-result"
    },
    "defaults": {
      "timeoutSec": 60,
      "retryMax": 0,
      "retryBackoffSec": 0,
      "cacheMode": "off",
      "ledgerMode": "required",
      "humanGateRequired": false,
      "lane": "dev"
    },
    "policy": {
      "policyPackRef": "protocol/agentic-workbench/v1/policy_packs/workspace-default.v0.1.json",
      "policyPackHash": "sha256:5bf7c8abab452ccf16685af2780af25d0d85e9a09a7c4b9a31e548a9fc50296c",
      "trustProfileRef": "protocol/agentic-workbench/v1/trust_profiles/default.v0.1.json",
      "defaultQuorumRule": "2of3-human",
      "attestationRequired": true,
      "ledgerMode": "required"
    },
    "steps": [
      {
        "stepId": "delegate-a2a",
        "name": "delegate work to remote agent",
        "transport": "a2a",
        "capabilityRef": "capd://caps.bus.tritrpc",
        "effect": "compute",
        "target": {
          "agentId": "remote-agent",
          "skill": "delegate-work"
        },
        "placement": {
          "side": "either"
        },
        "approval": {
          "required": false
        },
        "observability": {
          "traceLevel": "standard"
        }
      }
    ],
    "edges": [],
    "bundleProjection": {
      "targetRepo": "agentplane",
      "artifactOutDir": "artifacts/a2a-delegate-smoke",
      "executorStrategy": "placement",
      "backendIntentDefault": "fleet"
    }
  }
}
